{
  "id": "550e8400-e29b-41d4-a716-446655440000",
  "name": {
    "given": "Eleanor",
    "family": "Whitfield"
  },
  "emails": [
    {
      "address": "eleanor.whitfield@company.com",
      "type": "work",
      "primary": true
    },
    {
      "address": "eleanor@personal.email",
      "type": "home"
    }
  ],
  "phones": [
    {
      "number": "+44 7700 900123",
      "type": "mobile"
    }
  ],
  "addresses": [
    {
      "street": "42 Innovation Drive",
      "city": "Cambridge",
      "region": "Cambridgeshire",
      "postal_code": "CB1 2AB",
      "country": "United Kingdom"
    }
  ],
  "organization": "Whitfield Research Labs",
  "source": "carddav",
  "source_id": "fixture-contact-001",
  "extensions": {
    "com.life-engine.example": {
      "department": "Engineering",
      "preferred_language": "en-GB"
    }
  },
  "created_at": "2026-01-15T10:30:00Z",
  "updated_at": "2026-01-15T10:30:00Z"
}
